[
  {
    "reserved": true,
    "name": "Run_201511170000_A8",
    "id": 31,
    "createdAt": "2015-11-16T16:02:07.433",
    "createdBy": "root",
    "summary": "lambdaNEB"
  },
  {
    "reserved": true,
    "name": "Run_201511181921_A11",
    "id": 44,
    "createdAt": "2015-11-18T11:46:45.527",
    "createdBy": "root",
    "summary": "lambdaNEB"
  },
  {
    "reserved": true,
    "name": "Run_201511180030_A12",
    "id": 40,
    "createdAt": "2015-11-17T16:30:52.743",
    "createdBy": "root",
    "summary": "lambdaNEB"
  },
  {
    "reserved": true,
    "name": "Run_201511182001_A12",
    "id": 45,
    "createdAt": "2015-11-18T12:01:52.923",
    "createdBy": "root",
    "summary": "lambdaNEB"
  },
  {
    "reserved": true,
    "name": "Run_201511190048_A11",
    "id": 47,
    "createdAt": "2015-11-18T17:35:27.825",
    "createdBy": "root",
    "summary": "lambdaNEB"
  },
  {
    "reserved": true,
    "name": "Run_201511190125_A12",
    "id": 48,
    "createdAt": "2015-11-18T17:38:49.910",
    "createdBy": "root",
    "summary": "lambdaNEB"
  },
  {
    "reserved": true,
    "name": "Run_201511170019_A8",
    "id": 32,
    "createdAt": "2015-11-16T16:20:10.316",
    "createdBy": "root",
    "summary": "lambdaNEB"
  },
  {
    "reserved": true,
    "name": "Run_201511172355_A11",
    "id": 39,
    "createdAt": "2015-11-17T16:03:20.024",
    "createdBy": "root",
    "summary": "lambdaNEB"
  },
  {
    "reserved": true,
    "name": "Run_201511172336_A11",
    "id": 38,
    "createdAt": "2015-11-17T15:37:06.870",
    "createdBy": "root",
    "summary": "lambdaNEB"
  }
]
